match_id,date,venue,team1,team2,toss_winner,toss_decision,winner,result,team1_score,team2_score,team1_players,team2_players,venue_avg_score,chasing_win_rate_venue,team1_win_rate_at_venue,team2_win_rate_at_venue,team1_total_wins_against_team2,team2_total_wins_against_team1,team1_wins_against_team2_last_three,team2_wins_against_team1_last_three,team1_form_last_5,team2_form_last_5,team1_last_5_avg_score,team1_last_5_runs_conceded,team2_last_5_avg_score,team2_last_5_runs_conceded,team1_chasing_win_rate,team1_defending_win_rate,team2_chasing_win_rate,team2_defending_win_rate
980999,2016-05-18,M Chinnaswamy Stadium,Royal Challengers Bangalore,Kings XI Punjab,Kings XI Punjab,field,Royal Challengers Bangalore,won by 82 runs,211,120,"CH Gayle, V Kohli, AB de Villiers, KL Rahul, SR Watson, Sachin Baby, STR Binny, CJ Jordan, S Aravind, VR Aaron, YS Chahal","M Vijay, HM Amla, WP Saha, DA Miller, Gurkeerat Singh, AR Patel, F Behardien, KJ Abbott, MM Sharma, KC Cariappa, Sandeep Sharma",157.83636363636364,0.5208333333333334,0.490566037735849,0.5,7.0,10.0,2.0,1.0,4,2,191.0,161.0,163.6,163.0,0.5348837209302325,0.4375,0.5263157894736842,0.2083333333333333
981001,2016-05-19,Green Park,Kolkata Knight Riders,Gujarat Lions,Gujarat Lions,field,Gujarat Lions,won by 6 wickets,124,125,"DR Smith, BB McCullum, SK Raina, KD Karthik, AJ Finch, RA Jadeja, DJ Bravo, ER Dwivedi, P Kumar, SB Jakati, DS Kulkarni","RV Uthappa, G Gambhir, MK Pandey, PP Chawla, YK Pathan, Shakib Al Hasan, SA Yadav, JO Holder, SP Narine, M Morkel, AS Rajpoot",0.0,0.0,0.0,0.0,0.0,1.0,0.0,1.0,3,1,152.0,159.0,134.8,167.8,0.6052631578947368,0.5,0.6666666666666666,0.0
981003,2016-05-20,Shaheed Veer Narayan Singh International Stadium,Sunrisers Hyderabad,Delhi Daredevils,Delhi Daredevils,field,Delhi Daredevils,won by 6 wickets,158,161,"Q de Kock, RR Pant, KK Nair, JP Duminy, CR Brathwaite, SV Samson, P Negi, A Mishra, Z Khan, J Yadav, NM Coulter-Nile","DA Warner, S Dhawan, DJ Hooda, Yuvraj Singh, MC Henriques, EJG Morgan, NV Ojha, B Kumar, KV Sharma, Mustafizur Rahman, BB Sran",143.125,0.0,1.0,0.75,5.0,2.0,1.0,2.0,4,1,153.8,136.0,146.2,155.0,0.6363636363636364,0.3125,0.475,0.3478260869565217
981005,2016-05-21,Dr. Y.S. Rajasekhara Reddy ACA-VDCA Cricket Stadium,Kings XI Punjab,Rising Pune Supergiants,Kings XI Punjab,bat,Rising Pune Supergiants,won by 4 wickets,172,173,"AM Rahane, UT Khawaja, GJ Bailey, SS Tiwary, MS Dhoni, IK Pathan, NLTC Perera, R Ashwin, A Zampa, AB Dinda, DL Chahar","HM Amla, M Vijay, WP Saha, Gurkeerat Singh, DA Miller, F Behardien, AR Patel, R Dhawan, KJ Abbott, MM Sharma, Sandeep Sharma",138.8,0.3333333333333333,1.0,0.5,1.0,0.0,1.0,0.0,2,2,156.2,172.4,133.8,136.2,0.5128205128205128,0.2083333333333333,0.75,0.0
981007,2016-05-21,Green Park,Mumbai Indians,Gujarat Lions,Gujarat Lions,field,Gujarat Lions,won by 6 wickets,172,173,"AJ Finch, BB McCullum, SK Raina, KD Karthik, DR Smith, RA Jadeja, DJ Bravo, ER Dwivedi, SB Jakati, P Kumar, DS Kulkarni","RG Sharma, MJ Guptill, N Rana, KH Pandya, JC Buttler, KA Pollard, HH Pandya, Harbhajan Singh, R Vinay Kumar, MJ McClenaghan, JJ Bumrah",124.5,1.0,0.0,1.0,0.0,1.0,0.0,1.0,3,2,147.2,148.0,133.6,161.8,0.5555555555555556,0.5526315789473685,0.7142857142857143,0.0
981011,2016-05-22,Shaheed Veer Narayan Singh International Stadium,Delhi Daredevils,Royal Challengers Bangalore,Royal Challengers Bangalore,field,Royal Challengers Bangalore,won by 6 wickets,138,139,"Q de Kock, RR Pant, KK Nair, SV Samson, SW Billings, P Negi, CR Brathwaite, CH Morris, J Yadav, A Mishra, Z Khan","CH Gayle, V Kohli, AB de Villiers, KL Rahul, SR Watson, STR Binny, Sachin Baby, CJ Jordan, Iqbal Abdulla, S Aravind, YS Chahal",146.4,0.5,0.8,0.0,6.0,8.0,1.0,1.0,2,4,146.0,153.4,194.2,146.8,0.4878048780487805,0.3478260869565217,0.5348837209302325,0.4375
981009,2016-05-22,Eden Gardens,Kolkata Knight Riders,Sunrisers Hyderabad,Sunrisers Hyderabad,field,Kolkata Knight Riders,won by 22 runs,171,149,"RV Uthappa, G Gambhir, C Munro, MK Pandey, YK Pathan, JO Holder, Shakib Al Hasan, SA Yadav, AS Rajpoot, SP Narine, Kuldeep Yadav","S Dhawan, DA Warner, NV Ojha, Yuvraj Singh, KS Williamson, DJ Hooda, MC Henriques, KV Sharma, B Kumar, BB Sran, Mustafizur Rahman",147.24528301886792,0.72,0.64,0.0,5.0,2.0,2.0,1.0,2,3,139.0,147.0,159.6,143.0,0.6052631578947368,0.5,0.6363636363636364,0.3125
981013,2016-05-24,M Chinnaswamy Stadium,Gujarat Lions,Royal Challengers Bangalore,Royal Challengers Bangalore,field,Royal Challengers Bangalore,won by 4 wickets,158,159,"AJ Finch, BB McCullum, SK Raina, KD Karthik, DR Smith, RA Jadeja, DJ Bravo, ER Dwivedi, P Kumar, DS Kulkarni, SB Jakati","CH Gayle, V Kohli, AB de Villiers, KL Rahul, SR Watson, Sachin Baby, STR Binny, Iqbal Abdulla, CJ Jordan, S Aravind, YS Chahal",157.97321428571428,0.5102040816326531,0.0,0.5,1.0,1.0,1.0,1.0,3,4,138.4,166.2,187.0,139.6,0.75,0.0,0.5454545454545454,0.4375
981015,2016-05-25,Feroz Shah Kotla,Sunrisers Hyderabad,Kolkata Knight Riders,Kolkata Knight Riders,field,Sunrisers Hyderabad,won by 22 runs,162,140,"DA Warner, S Dhawan, MC Henriques, Yuvraj Singh, DJ Hooda, BCJ Cutting, NV Ojha, B Kumar, Bipul Sharma, BB Sran, Mustafizur Rahman","RV Uthappa, G Gambhir, C Munro, MK Pandey, YK Pathan, SA Yadav, R Sathish, JO Holder, SP Narine, M Morkel, Kuldeep Yadav",151.14705882352942,0.5517241379310345,0.6666666666666666,0.6666666666666666,2.0,6.0,0.0,3.0,2,2,154.0,158.8,140.4,145.4,0.5833333333333334,0.3125,0.6052631578947368,0.5
981017,2016-05-27,Feroz Shah Kotla,Gujarat Lions,Sunrisers Hyderabad,Sunrisers Hyderabad,field,Sunrisers Hyderabad,won by 4 wickets,162,163,"ER Dwivedi, BB McCullum, SK Raina, KD Karthik, AJ Finch, DR Smith, RA Jadeja, DJ Bravo, DS Kulkarni, P Kumar, S Kaushik","DA Warner, S Dhawan, MC Henriques, Yuvraj Singh, DJ Hooda, BCJ Cutting, NV Ojha, Bipul Sharma, B Kumar, BB Sran, TA Boult",151.14423076923077,0.5333333333333333,1.0,0.75,0.0,2.0,0.0,2.0,3,2,144.8,172.2,159.0,160.2,0.75,0.0,0.5833333333333334,0.3125
981019,2016-05-29,M Chinnaswamy Stadium,Sunrisers Hyderabad,Royal Challengers Bangalore,Sunrisers Hyderabad,bat,Sunrisers Hyderabad,won by 8 runs,208,200,"CH Gayle, V Kohli, AB de Villiers, KL Rahul, SR Watson, Sachin Baby, STR Binny, CJ Jordan, Iqbal Abdulla, S Aravind, YS Chahal","DA Warner, S Dhawan, MC Henriques, Yuvraj Singh, DJ Hooda, BCJ Cutting, NV Ojha, Bipul Sharma, B Kumar, BB Sran, Mustafizur Rahman",157.98245614035088,0.52,0.25,0.509090909090909,3.0,4.0,1.0,2.0,3,5,162.4,162.6,188.6,140.6,0.6153846153846154,0.3125,0.5555555555555556,0.4375
1082591,2017-04-05,"Rajiv Gandhi International Stadium, Uppal",Sunrisers Hyderabad,Royal Challengers Bangalore,Royal Challengers Bangalore,field,Sunrisers Hyderabad,won by 35 runs,207,172,"DA Warner, S Dhawan, MC Henriques, Yuvraj Singh, DJ Hooda, BCJ Cutting, NV Ojha, Bipul Sharma, B Kumar, A Nehra, Rashid Khan","CH Gayle, Mandeep Singh, TM Head, KM Jadhav, SR Watson, Sachin Baby, STR Binny, S Aravind, TS Mills, YS Chahal, A Choudhary",150.3658536585366,0.5238095238095238,0.5652173913043478,0.2857142857142857,4.0,4.0,2.0,1.0,3,4,168.0,166.8,179.0,161.4,0.6153846153846154,0.3529411764705882,0.5555555555555556,0.4375
1082592,2017-04-06,Maharashtra Cricket Association Stadium,Mumbai Indians,Rising Pune Supergiant,Rising Pune Supergiant,field,Rising Pune Supergiant,won by 7 wickets,184,187,"AM Rahane, MA Agarwal, SPD Smith, BA Stokes, MS Dhoni, MK Tiwary, R Bhatia, DL Chahar, A Zampa, AB Dinda, Imran Tahir","PA Patel, JC Buttler, RG Sharma, N Rana, AT Rayudu, KH Pandya, KA Pollard, HH Pandya, TG Southee, MJ McClenaghan, JJ Bumrah",158.44444444444446,0.5714285714285714,1.0,0.0,0.0,0.0,0.0,0.0,2,0,149.4,150.8,0.0,0.0,0.5555555555555556,0.5526315789473685,0.0,0.0
1082593,2017-04-07,Saurashtra Cricket Association Stadium,Gujarat Lions,Kolkata Knight Riders,Kolkata Knight Riders,field,Kolkata Knight Riders,won by 10 wickets,183,184,"JJ Roy, BB McCullum, SK Raina, AJ Finch, KD Karthik, DR Smith, MS Gony, P Kumar, SB Jakati, DS Kulkarni, S Kaushik","G Gambhir, CA Lynn, RV Uthappa, MK Pandey, YK Pathan, SA Yadav, CR Woakes, PP Chawla, Kuldeep Yadav, SP Narine, TA Boult",154.5,0.6666666666666666,0.4,0.0,2.0,0.0,2.0,0.0,2,2,144.4,173.2,136.8,145.0,0.75,0.0,0.5897435897435898,0.5
1082594,2017-04-08,Holkar Cricket Stadium,Rising Pune Supergiant,Kings XI Punjab,Kings XI Punjab,field,Kings XI Punjab,won by 6 wickets,163,164,"HM Amla, M Vohra, WP Saha, AR Patel, GJ Maxwell, DA Miller, MP Stoinis, Swapnil Singh, MM Sharma, Sandeep Sharma, T Natarajan","AM Rahane, MA Agarwal, SPD Smith, BA Stokes, MS Dhoni, MK Tiwary, DT Christian, R Bhatia, RD Chahar, Imran Tahir, AB Dinda",138.5,1.0,0.0,1.0,0.0,0.0,0.0,0.0,1,1,187.0,184.0,154.4,172.6,1.0,0.0,0.5128205128205128,0.2
1082595,2017-04-08,M.Chinnaswamy Stadium,Royal Challengers Bangalore,Delhi Daredevils,Royal Challengers Bangalore,bat,Royal Challengers Bangalore,won by 15 runs,157,142,"CH Gayle, SR Watson, Mandeep Singh, KM Jadhav, STR Binny, Vishnu Vinod, P Negi, Iqbal Abdulla, TS Mills, YS Chahal, B Stanlake","AP Tare, SW Billings, KK Nair, SV Samson, RR Pant, CH Morris, CR Brathwaite, PJ Cummins, A Mishra, S Nadeem, Z Khan",0.0,0.0,0.0,0.0,9.0,6.0,1.0,1.0,3,2,176.2,166.2,139.2,145.0,0.5434782608695652,0.4375,0.4878048780487805,0.3478260869565217
1082596,2017-04-09,"Rajiv Gandhi International Stadium, Uppal",Gujarat Lions,Sunrisers Hyderabad,Sunrisers Hyderabad,field,Sunrisers Hyderabad,won by 9 wickets,135,140,"DA Warner, S Dhawan, MC Henriques, Yuvraj Singh, DJ Hooda, BCJ Cutting, NV Ojha, Bipul Sharma, B Kumar, A Nehra, Rashid Khan","JJ Roy, BB McCullum, SK Raina, AJ Finch, KD Karthik, DR Smith, DS Kulkarni, P Kumar, Basil Thampi, Tejas Baroka, S Kaushik",151.29761904761904,0.5,0.0,0.5833333333333334,0.0,3.0,0.0,3.0,2,4,160.2,160.4,177.8,169.0,0.75,0.0,0.6153846153846154,0.3529411764705882
1082597,2017-04-09,Wankhede Stadium,Kolkata Knight Riders,Mumbai Indians,Mumbai Indians,field,Mumbai Indians,won by 4 wickets,178,180,"PA Patel, JC Buttler, N Rana, RG Sharma, KH Pandya, KA Pollard, HH Pandya, Harbhajan Singh, MJ McClenaghan, SL Malinga, JJ Bumrah","G Gambhir, CA Lynn, RV Uthappa, MK Pandey, YK Pathan, SA Yadav, CR Woakes, SP Narine, Kuldeep Yadav, AS Rajpoot, TA Boult",156.0408163265306,0.4827586206896552,0.1666666666666666,0.6444444444444445,5.0,13.0,0.0,3.0,2,2,160.4,161.0,167.8,152.8,0.6,0.5,0.5555555555555556,0.5526315789473685
1082598,2017-04-10,Holkar Cricket Stadium,Royal Challengers Bangalore,Kings XI Punjab,Royal Challengers Bangalore,bat,Kings XI Punjab,won by 8 wickets,148,150,"M Vohra, HM Amla, AR Patel, GJ Maxwell, WP Saha, DA Miller, MP Stoinis, MM Sharma, Sandeep Sharma, VR Aaron, T Natarajan","SR Watson, Vishnu Vinod, AB de Villiers, KM Jadhav, Mandeep Singh, STR Binny, P Negi, Iqbal Abdulla, TS Mills, B Stanlake, YS Chahal",146.83333333333334,1.0,0.0,1.0,8.0,10.0,2.0,1.0,3,2,165.4,170.6,152.4,170.2,0.5434782608695652,0.4705882352941176,0.525,0.2
1082599,2017-04-11,Maharashtra Cricket Association Stadium,Delhi Daredevils,Rising Pune Supergiant,Rising Pune Supergiant,field,Delhi Daredevils,won by 97 runs,205,108,"AM Rahane, MA Agarwal, F du Plessis, RA Tripathi, BA Stokes, MS Dhoni, R Bhatia, DL Chahar, A Zampa, AB Dinda, Imran Tahir","AP Tare, SW Billings, SV Samson, RR Pant, CJ Anderson, CH Morris, KK Nair, PJ Cummins, A Mishra, Z Khan, S Nadeem",161.15,0.625,1.0,1.0,0.0,0.0,0.0,0.0,1,1,137.6,147.2,175.0,174.0,0.4878048780487805,0.3478260869565217,1.0,0.0
1082600,2017-04-12,Wankhede Stadium,Sunrisers Hyderabad,Mumbai Indians,Mumbai Indians,field,Mumbai Indians,won by 4 wickets,158,159,"PA Patel, JC Buttler, RG Sharma, N Rana, KA Pollard, KH Pandya, HH Pandya, Harbhajan Singh, MJ McClenaghan, SL Malinga, JJ Bumrah","S Dhawan, DA Warner, DJ Hooda, Yuvraj Singh, BCJ Cutting, NV Ojha, V Shankar, Rashid Khan, B Kumar, A Nehra, Mustafizur Rahman",156.5,0.5,0.0,0.6521739130434783,4.0,4.0,2.0,1.0,5,2,176.0,161.8,173.2,158.2,0.6428571428571429,0.3529411764705882,0.5675675675675675,0.5526315789473685
1082601,2017-04-13,Eden Gardens,Kings XI Punjab,Kolkata Knight Riders,Kolkata Knight Riders,field,Kolkata Knight Riders,won by 8 wickets,170,171,"SP Narine, G Gambhir, RV Uthappa, MK Pandey, YK Pathan, SA Yadav, CR Woakes, C de Grandhomme, PP Chawla, UT Yadav, TA Boult","HM Amla, M Vohra, MP Stoinis, GJ Maxwell, DA Miller, WP Saha, AR Patel, MM Sharma, VR Aaron, Sandeep Sharma, I Sharma",147.4814814814815,0.6923076923076923,0.25,0.6470588235294118,6.0,13.0,0.0,3.0,2,2,157.0,175.0,159.4,159.8,0.525,0.2,0.6,0.5
1082603,2017-04-14,Saurashtra Cricket Association Stadium,Rising Pune Supergiant,Gujarat Lions,Gujarat Lions,field,Gujarat Lions,won by 7 wickets,171,172,"DR Smith, BB McCullum, SK Raina, KD Karthik, AJ Finch, Ishan Kishan, RA Jadeja, P Kumar, Basil Thampi, AJ Tye, SB Jakati","AM Rahane, RA Tripathi, SPD Smith, BA Stokes, MK Tiwary, MS Dhoni, Ankit Sharma, SN Thakur, LH Ferguson, RD Chahar, Imran Tahir",159.33333333333334,0.75,0.0,0.3333333333333333,0.0,0.0,0.0,0.0,1,1,152.67,184.33,162.2,163.6,0.5,0.0,0.75,0.0
1082602,2017-04-14,M Chinnaswamy Stadium,Royal Challengers Bangalore,Mumbai Indians,Mumbai Indians,field,Mumbai Indians,won by 4 wickets,142,145,"CH Gayle, V Kohli, AB de Villiers, KM Jadhav, P Negi, Mandeep Singh, STR Binny, TS Mills, S Aravind, YS Chahal, S Badree","PA Patel, JC Buttler, RG Sharma, MJ McClenaghan, N Rana, KA Pollard, KH Pandya, HH Pandya, Harbhajan Singh, JJ Bumrah, TG Southee",158.77586206896552,0.52,0.5,0.75,8.0,11.0,1.0,2.0,2,3,167.2,173.0,180.2,164.4,0.5434782608695652,0.4444444444444444,0.5789473684210527,0.5526315789473685
1082604,2017-04-15,Eden Gardens,Kolkata Knight Riders,Sunrisers Hyderabad,Sunrisers Hyderabad,field,Kolkata Knight Riders,won by 17 runs,172,155,"SP Narine, G Gambhir, RV Uthappa, MK Pandey, YK Pathan, SA Yadav, C de Grandhomme, CR Woakes, Kuldeep Yadav, UT Yadav, TA Boult","DA Warner, S Dhawan, MC Henriques, Yuvraj Singh, DJ Hooda, BCJ Cutting, NV Ojha, Bipul Sharma, B Kumar, Rashid Khan, A Nehra",147.9,0.7037037037037037,0.6538461538461539,0.0,6.0,3.0,2.0,1.0,3,4,168.8,168.8,175.2,165.6,0.6097560975609756,0.5,0.6428571428571429,0.3529411764705882
1082605,2017-04-15,Feroz Shah Kotla,Delhi Daredevils,Kings XI Punjab,Delhi Daredevils,bat,Delhi Daredevils,won by 51 runs,188,137,"SV Samson, SW Billings, KK Nair, SS Iyer, RR Pant, CJ Anderson, CH Morris, PJ Cummins, A Mishra, Z Khan, S Nadeem","M Vohra, HM Amla, WP Saha, EJG Morgan, DA Miller, GJ Maxwell, AR Patel, MM Sharma, KC Cariappa, Sandeep Sharma, VR Aaron",151.35849056603774,0.5483870967741935,0.3877551020408163,0.5,8.0,10.0,2.0,1.0,2,2,153.4,127.6,155.2,173.2,0.4878048780487805,0.3478260869565217,0.525,0.2
1082607,2017-04-16,M Chinnaswamy Stadium,Rising Pune Supergiant,Royal Challengers Bangalore,Royal Challengers Bangalore,field,Rising Pune Supergiant,won by 27 runs,161,134,"V Kohli, Mandeep Singh, AB de Villiers, KM Jadhav, SR Watson, STR Binny, P Negi, AF Milne, S Badree, S Aravind, YS Chahal","AM Rahane, RA Tripathi, SPD Smith, MS Dhoni, BA Stokes, DT Christian, MK Tiwary, SN Thakur, JD Unadkat, RD Chahar, Imran Tahir",158.51694915254237,0.5294117647058824,0.0,0.4912280701754385,0.0,0.0,0.0,0.0,1,1,157.25,181.25,163.8,170.4,0.5,0.0,0.5434782608695652,0.4444444444444444
1082606,2017-04-16,Wankhede Stadium,Gujarat Lions,Mumbai Indians,Mumbai Indians,field,Mumbai Indians,won by 6 wickets,176,177,"PA Patel, JC Buttler, N Rana, RG Sharma, KA Pollard, HH Pandya, KH Pandya, Harbhajan Singh, MJ McClenaghan, SL Malinga, JJ Bumrah","DR Smith, BB McCullum, SK Raina, Ishan Kishan, KD Karthik, JJ Roy, RA Jadeja, P Kumar, Basil Thampi, AJ Tye, MM Patel",156.5392156862745,0.5161290322580645,1.0,0.6595744680851063,2.0,0.0,2.0,0.0,1,3,162.0,163.4,168.0,167.6,0.7777777777777778,0.0,0.5897435897435898,0.5526315789473685
1082608,2017-04-17,Feroz Shah Kotla,Delhi Daredevils,Kolkata Knight Riders,Delhi Daredevils,bat,Kolkata Knight Riders,won by 4 wickets,168,169,"SV Samson, SW Billings, KK Nair, SS Iyer, RR Pant, AD Mathews, CH Morris, PJ Cummins, Mohammed Shami, A Mishra, Z Khan","G Gambhir, C de Grandhomme, RV Uthappa, MK Pandey, YK Pathan, SA Yadav, CR Woakes, SP Narine, NM Coulter-Nile, Kuldeep Yadav, UT Yadav",151.5648148148148,0.5483870967741935,0.4,0.5714285714285714,7.0,10.0,1.0,2.0,3,3,166.8,139.8,169.0,170.0,0.4878048780487805,0.375,0.6097560975609756,0.5
1082609,2017-04-17,"Rajiv Gandhi International Stadium, Uppal",Sunrisers Hyderabad,Kings XI Punjab,Kings XI Punjab,field,Sunrisers Hyderabad,won by 5 runs,159,154,"DA Warner, S Dhawan, MC Henriques, Yuvraj Singh, NV Ojha, DJ Hooda, Mohammad Nabi, Rashid Khan, B Kumar, BB Sran, S Kaul","HM Amla, M Vohra, GJ Maxwell, EJG Morgan, DA Miller, WP Saha, AR Patel, MM Sharma, KC Cariappa, I Sharma, Sandeep Sharma",150.97674418604652,0.5217391304347826,0.6,0.5714285714285714,6.0,2.0,3.0,0.0,3,2,173.6,167.6,158.6,168.6,0.6,0.3529411764705882,0.525,0.2
1082610,2017-04-18,Saurashtra Cricket Association Stadium,Royal Challengers Bangalore,Gujarat Lions,Gujarat Lions,field,Royal Challengers Bangalore,won by 21 runs,213,192,"DR Smith, BB McCullum, SK Raina, AJ Finch, KD Karthik, RA Jadeja, Ishan Kishan, AJ Tye, Basil Thampi, DS Kulkarni, S Kaushik","CH Gayle, V Kohli, TM Head, KM Jadhav, SR Watson, Mandeep Singh, STR Binny, P Negi, AF Milne, S Aravind, YS Chahal",161.07142857142858,0.8,0.0,0.4285714285714285,2.0,1.0,2.0,1.0,1,1,150.6,161.0,165.6,167.0,0.5319148936170213,0.4444444444444444,0.7777777777777778,0.0
1082611,2017-04-19,"Rajiv Gandhi International Stadium, Uppal",Sunrisers Hyderabad,Delhi Daredevils,Sunrisers Hyderabad,bat,Sunrisers Hyderabad,won by 15 runs,191,176,"DA Warner, S Dhawan, KS Williamson, Yuvraj Singh, MC Henriques, DJ Hooda, NV Ojha, B Kumar, Rashid Khan, Mohammed Siraj, S Kaul","SV Samson, SW Billings, KK Nair, RR Pant, SS Iyer, AD Mathews, CH Morris, J Yadav, PJ Cummins, A Mishra, Z Khan",151.10227272727272,0.5,0.6153846153846154,0.8,5.0,3.0,1.0,2.0,3,2,163.8,158.4,168.2,142.0,0.6,0.3529411764705882,0.4878048780487805,0.36
1082612,2017-04-20,Holkar Cricket Stadium,Kings XI Punjab,Mumbai Indians,Mumbai Indians,field,Mumbai Indians,won by 8 wickets,198,199,"HM Amla, SE Marsh, WP Saha, GJ Maxwell, MP Stoinis, AR Patel, Gurkeerat Singh, Swapnil Singh, MM Sharma, Sandeep Sharma, I Sharma","PA Patel, JC Buttler, N Rana, HH Pandya, RG Sharma, KA Pollard, KH Pandya, Harbhajan Singh, MJ McClenaghan, SL Malinga, JJ Bumrah",147.375,1.0,1.0,0.0,9.0,9.0,1.0,2.0,2,4,155.0,165.8,169.0,168.2,0.5121951219512195,0.2,0.6,0.5526315789473685
1082613,2017-04-21,Eden Gardens,Kolkata Knight Riders,Gujarat Lions,Gujarat Lions,field,Gujarat Lions,won by 4 wickets,187,188,"SP Narine, G Gambhir, RV Uthappa, MK Pandey, YK Pathan, SA Yadav, Shakib Al Hasan, CR Woakes, NM Coulter-Nile, Kuldeep Yadav, UT Yadav","AJ Finch, BB McCullum, SK Raina, KD Karthik, Ishan Kishan, DR Smith, RA Jadeja, JP Faulkner, P Kumar, Basil Thampi, DS Kulkarni",148.17857142857142,0.6785714285714286,0.660377358490566,1.0,1.0,2.0,1.0,2.0,4,1,174.8,171.2,171.6,177.0,0.6097560975609756,0.5,0.7,0.0
1082615,2017-04-22,Maharashtra Cricket Association Stadium,Sunrisers Hyderabad,Rising Pune Supergiant,Rising Pune Supergiant,field,Rising Pune Supergiant,won by 6 wickets,176,179,"AM Rahane, RA Tripathi, SPD Smith, MS Dhoni, BA Stokes, MK Tiwary, DT Christian, Washington Sundar, SN Thakur, JD Unadkat, Imran Tahir","DA Warner, S Dhawan, KS Williamson, MC Henriques, DJ Hooda, NV Ojha, Bipul Sharma, B Kumar, Rashid Khan, Mohammed Siraj, S Kaul",160.72727272727272,0.5555555555555556,1.0,0.5,0.0,0.0,0.0,0.0,3,2,160.6,159.2,158.0,171.8,0.6,0.3888888888888889,0.5,0.0
1082614,2017-04-22,Wankhede Stadium,Mumbai Indians,Delhi Daredevils,Delhi Daredevils,field,Mumbai Indians,won by 14 runs,142,128,"PA Patel, JC Buttler, N Rana, RG Sharma, KA Pollard, KH Pandya, HH Pandya, Harbhajan Singh, MJ McClenaghan, MG Johnson, JJ Bumrah","SV Samson, AP Tare, KK Nair, SS Iyer, CJ Anderson, RR Pant, K Rabada, CH Morris, PJ Cummins, A Mishra, Z Khan",156.92307692307693,0.53125,0.6666666666666666,0.1666666666666666,9.0,9.0,2.0,1.0,5,2,172.0,170.4,175.8,152.4,0.6097560975609756,0.5526315789473685,0.4878048780487805,0.36
1082616,2017-04-23,Saurashtra Cricket Association Stadium,Kings XI Punjab,Gujarat Lions,Gujarat Lions,field,Kings XI Punjab,won by 26 runs,188,162,"BB McCullum, AJ Finch, SK Raina, KD Karthik, RA Jadeja, DR Smith, AD Nath, AJ Tye, Basil Thampi, SS Agarwal, NB Singh","M Vohra, HM Amla, SE Marsh, GJ Maxwell, MP Stoinis, AR Patel, WP Saha, MM Sharma, KC Cariappa, T Natarajan, Sandeep Sharma",166.25,0.6666666666666666,1.0,0.375,1.0,1.0,1.0,1.0,1,2,161.8,173.0,172.6,177.6,0.5121951219512195,0.2,0.7272727272727273,0.0
1082617,2017-04-23,Eden Gardens,Kolkata Knight Riders,Royal Challengers Bangalore,Royal Challengers Bangalore,field,Kolkata Knight Riders,won by 82 runs,131,49,"SP Narine, G Gambhir, RV Uthappa, MK Pandey, YK Pathan, SA Yadav, C de Grandhomme, CR Woakes, NM Coulter-Nile, UT Yadav, Kuldeep Yadav","CH Gayle, V Kohli, Mandeep Singh, AB de Villiers, KM Jadhav, STR Binny, P Negi, S Badree, TS Mills, S Aravind, YS Chahal",148.8684210526316,0.6896551724137931,0.6481481481481481,0.4285714285714285,9.0,9.0,1.0,2.0,3,2,175.4,172.2,158.8,158.0,0.6097560975609756,0.5,0.5319148936170213,0.4444444444444444
1082618,2017-04-24,Wankhede Stadium,Rising Pune Supergiant,Mumbai Indians,Mumbai Indians,field,Rising Pune Supergiant,won by 3 runs,160,157,"PA Patel, JC Buttler, N Rana, RG Sharma, KV Sharma, KA Pollard, HH Pandya, Harbhajan Singh, MJ McClenaghan, MG Johnson, JJ Bumrah","AM Rahane, RA Tripathi, SPD Smith, MS Dhoni, BA Stokes, MK Tiwary, DT Christian, Washington Sundar, SN Thakur, JD Unadkat, Imran Tahir",156.50943396226415,0.5151515151515151,0.0,0.673469387755102,1.0,0.0,1.0,0.0,2,5,156.4,170.2,164.4,160.4,0.6666666666666666,0.0,0.6097560975609756,0.5526315789473685
1082620,2017-04-26,Maharashtra Cricket Association Stadium,Rising Pune Supergiant,Kolkata Knight Riders,Kolkata Knight Riders,field,Kolkata Knight Riders,won by 7 wickets,182,184,"AM Rahane, RA Tripathi, SPD Smith, MS Dhoni, MK Tiwary, DT Christian, F du Plessis, Washington Sundar, SN Thakur, JD Unadkat, Imran Tahir","SP Narine, G Gambhir, RV Uthappa, DM Bravo, MK Pandey, YK Pathan, C de Grandhomme, CR Woakes, PP Chawla, Kuldeep Yadav, UT Yadav",162.125,0.6,0.6666666666666666,1.0,0.0,0.0,0.0,0.0,3,4,155.8,168.8,166.0,146.0,0.6666666666666666,0.0,0.6097560975609756,0.5
1082621,2017-04-27,M Chinnaswamy Stadium,Royal Challengers Bangalore,Gujarat Lions,Gujarat Lions,field,Gujarat Lions,won by 7 wickets,134,135,"CH Gayle, V Kohli, AB de Villiers, TM Head, KM Jadhav, Mandeep Singh, P Negi, S Badree, S Aravind, A Choudhary, YS Chahal","Ishan Kishan, BB McCullum, SK Raina, AJ Finch, RA Jadeja, KD Karthik, JP Faulkner, AJ Tye, Basil Thampi, NB Singh, Ankit Soni",158.33333333333334,0.5192307692307693,0.4827586206896552,0.0,3.0,1.0,3.0,0.0,1,2,137.2,155.8,178.0,187.2,0.5208333333333334,0.4444444444444444,0.6666666666666666,0.0
1082623,2017-04-28,"Punjab Cricket Association IS Bindra Stadium, Mohali",Sunrisers Hyderabad,Kings XI Punjab,Kings XI Punjab,field,Sunrisers Hyderabad,won by 26 runs,207,181,"MJ Guptill, M Vohra, SE Marsh, GJ Maxwell, EJG Morgan, WP Saha, AR Patel, Anureet Singh, MM Sharma, I Sharma, KC Cariappa","DA Warner, S Dhawan, KS Williamson, Yuvraj Singh, MC Henriques, DJ Hooda, NV Ojha, B Kumar, A Nehra, S Kaul, Rashid Khan",165.78571428571428,0.4,1.0,0.2857142857142857,7.0,2.0,3.0,0.0,2,1,167.8,168.0,169.4,175.8,0.6,0.3888888888888889,0.5121951219512195,0.2
1082622,2017-04-28,Eden Gardens,Delhi Daredevils,Kolkata Knight Riders,Kolkata Knight Riders,field,Kolkata Knight Riders,won by 7 wickets,160,161,"SP Narine, G Gambhir, RV Uthappa, MK Pandey, SP Jackson, YK Pathan, C de Grandhomme, CR Woakes, NM Coulter-Nile, UT Yadav, Kuldeep Yadav","SV Samson, KK Nair, SS Iyer, RR Pant, CH Morris, CJ Anderson, AR Bawne, PJ Cummins, K Rabada, A Mishra, Z Khan",147.85344827586206,0.6666666666666666,0.1666666666666666,0.6545454545454545,7.0,11.0,1.0,2.0,2,4,173.0,149.4,168.6,148.4,0.4761904761904761,0.36,0.6190476190476191,0.5
1082625,2017-04-29,Saurashtra Cricket Association Stadium,Gujarat Lions,Mumbai Indians,Gujarat Lions,bat,,,153,153,"Ishan Kishan, BB McCullum, SK Raina, AJ Finch, KD Karthik, RA Jadeja, JP Faulkner, IK Pathan, AJ Tye, Basil Thampi, Ankit Soni","PA Patel, JC Buttler, N Rana, RG Sharma, KA Pollard, KH Pandya, HH Pandya, Harbhajan Singh, MJ McClenaghan, JJ Bumrah, SL Malinga",167.22222222222223,0.5714285714285714,0.3333333333333333,0.0,2.0,1.0,2.0,1.0,2,4,170.6,179.8,164.0,160.8,0.6923076923076923,0.0,0.5952380952380952,0.5526315789473685
1082624,2017-04-29,Maharashtra Cricket Association Stadium,Rising Pune Supergiant,Royal Challengers Bangalore,Royal Challengers Bangalore,field,Rising Pune Supergiant,won by 61 runs,157,96,"AM Rahane, RA Tripathi, SPD Smith, MK Tiwary, MS Dhoni, DT Christian, Washington Sundar, LH Ferguson, JD Unadkat, DL Chahar, Imran Tahir","TM Head, V Kohli, AB de Villiers, KM Jadhav, Sachin Baby, STR Binny, P Negi, AF Milne, S Badree, S Aravind, YS Chahal",163.73076923076923,0.6363636363636364,0.5,1.0,1.0,0.0,1.0,0.0,3,1,170.6,164.6,134.4,152.8,0.6666666666666666,0.0,0.5208333333333334,0.4444444444444444
1082626,2017-04-30,"Punjab Cricket Association IS Bindra Stadium, Mohali",Delhi Daredevils,Kings XI Punjab,Kings XI Punjab,field,Kings XI Punjab,won by 10 wickets,67,68,"MJ Guptill, HM Amla, M Vohra, SE Marsh, GJ Maxwell, WP Saha, AR Patel, MM Sharma, VR Aaron, Sandeep Sharma, T Natarajan","SV Samson, SW Billings, KK Nair, SS Iyer, RR Pant, CJ Anderson, CH Morris, K Rabada, A Mishra, Mohammed Shami, S Nadeem",169.3125,0.3333333333333333,0.0,0.25,9.0,10.0,2.0,1.0,1,1,164.0,160.0,171.6,183.0,0.4761904761904761,0.36,0.5,0.2
